Metabolites	(met-c-845) Ratio of bisallylic groups to total fatty acids (M/F) Kettunen/2016 [ 13K]	met-c-845	Ratio of bisallylic groups to total fatty acids (M/F) Kettunen/2016 [ 13K]	0	0	1	0	0	0	0	0	0	0
Metabolites	(met-a-495) X-11315 (M/F) Shin/2014 [  7K]	met-a-495	X-11315 (M/F) Shin/2014 [  7K]	0	0	-1	0	0	0	0	-1	0	0
Proteins	(prot-a-54) Advanced glycosylation end product-specific receptor, soluble (M/F) Sun BB/2018 [  3K]	prot-a-54	Advanced glycosylation end product-specific receptor, soluble (M/F) Sun BB/2018 [  3K]	0	0	-1	0	-1	-1	0	0	0	0
Proteins	(prot-a-1148) Ferritin (M/F) Sun BB/2018 [  3K]	prot-a-1148	Ferritin (M/F) Sun BB/2018 [  3K]	0	0	1	0	0	0	0	0	0	0
Proteins	(prot-a-1097) Fibroblast growth factor 7 (M/F) Sun BB/2018 [  3K]	prot-a-1097	Fibroblast growth factor 7 (M/F) Sun BB/2018 [  3K]	0	0	1	0	0	0	0	0	0	0
Proteins	(prot-a-1779) Low-density lipoprotein receptor-related protein 1B (M/F) Sun BB/2018 [  3K]	prot-a-1779	Low-density lipoprotein receptor-related protein 1B (M/F) Sun BB/2018 [  3K]	0	0	-1	0	0	0	0	0	0	0
Proteins	(prot-a-2357) PR domain zinc finger protein 1 (M/F) Sun BB/2018 [  3K]	prot-a-2357	PR domain zinc finger protein 1 (M/F) Sun BB/2018 [  3K]	0	0	1	0	0	1	0	0	0	0
Proteins	(prot-a-3123) Thioredoxin domain-containing protein 12 (M/F) Sun BB/2018 [  3K]	prot-a-3123	Thioredoxin domain-containing protein 12 (M/F) Sun BB/2018 [  3K]	0	0	-1	0	0	0	-1	0	0	0
Proteins	(prot-a-3193) Vascular cell adhesion protein 1 (M/F) Sun BB/2018 [  3K]	prot-a-3193	Vascular cell adhesion protein 1 (M/F) Sun BB/2018 [  3K]	0	0	1	0	0	0	0	0	0	0
Proteins	(prot-b-38) interleukin 1 receptor like 1 (M/F) Folkersen L/2018 [  3K]	prot-b-38	interleukin 1 receptor like 1 (M/F) Folkersen L/2018 [  3K]	0	0	-1	0	-1	-1	0	0	0	0
Other biomarkers	(ieu-a-1047) Putamen volume (M/F) Hibar/2015 [ 30K]	ieu-a-1047	Putamen volume (M/F) Hibar/2015 [ 30K]	0	0	1	1	0	1	0	0	0	0
Other biomarkers	(ukb-d-30240_irnt) Reticulocyte percentage (M/F) Neale lab/2018 [344K]	ukb-d-30240_irnt	Reticulocyte percentage (M/F) Neale lab/2018 [344K]	0	0	-1	0	-1	-1	0	-1	0	0
Drugs	(ukb-b-15895) Drug: allopurinol (M/F) MRC-IEU/2018 [462K]	ukb-b-15895	Drug: allopurinol (M/F) MRC-IEU/2018 [462K]	0	0	-1	-1	0	0	0	0	0	0
